{
  "schema": "ferris.application-readiness-request/v1",
  "application_id": "ferris.fixture/three-workspace-application",
  "application_definition": {
    "path": "application.json",
    "digest": "sha256:2be4125716e491ef4ce760b27c402865cdb83511f0e822e8c3560aec05bed6bd"
  },
  "workspaces": [
    {
      "workspace_id": "ferris.fixture/alpha",
      "manifest_path": "alpha/Cargo.toml",
      "requirements_path": "requirements-alpha.json",
      "requirements_digest": "sha256:0ff29f8206abb665d9b2d579306c131a4867f3eb864112c0847f80ac93c39e24"
    },
    {
      "workspace_id": "ferris.fixture/beta",
      "manifest_path": "beta/Cargo.toml",
      "requirements_path": "requirements-beta.json",
      "requirements_digest": "sha256:7128d9b861ebd246baf928eed2671f4449c6db32f35696edddae63bc9bcb7fcb"
    },
    {
      "workspace_id": "ferris.fixture/gamma",
      "manifest_path": "gamma/Cargo.toml",
      "requirements_path": "requirements-gamma.json",
      "requirements_digest": "sha256:42c4740169b5aeb18aa5d8525288ba35aa6f8aa1ca02f639543ad7ccceed5899"
    }
  ]
}
